{
  "schema_version": "0.1.0",
  "event_id": "orion-evt-facility-risk-facility-asset",
  "event_type": "asset.facility",
  "title": "Critical facility asset in hazard corridor",
  "summary": "Synthetic facility asset used to demonstrate Gaia/Orion event fusion and map projection.",
  "observed_at": "2026-05-29T11:55:00Z",
  "location": {
    "type": "Point",
    "coordinates": [-121.5000, 38.5800]
  },
  "severity": "medium",
  "confidence": 0.9,
  "source_record_refs": ["gaia-src-facility-risk-facility-asset"],
  "asset_refs": ["asset.synthetic-facility-alpha"],
  "evidence_grade": "fixture.synthetic",
  "policy_state": "internal_view_allowed",
  "tags": ["facility-risk", "asset", "fixture"]
}
