{
  "schema_version": "0.1.0",
  "event_id": "orion-evt-facility-risk-cve-exposure",
  "event_type": "cyber.cve_exposure",
  "title": "Synthetic CVE exposure for facility vendor stack",
  "summary": "A synthetic CVE exposure affects the modeled facility vendor stack. This is passive enrichment only and does not authorize scanning or exploitation.",
  "observed_at": "2026-05-29T12:02:00Z",
  "valid_until": "2026-06-05T12:02:00Z",
  "location": {
    "type": "Point",
    "coordinates": [-121.5000, 38.5800]
  },
  "severity": "high",
  "confidence": 0.65,
  "source_record_refs": ["gaia-src-facility-risk-cve-exposure"],
  "asset_refs": ["asset.synthetic-facility-alpha"],
  "evidence_grade": "fixture.synthetic",
  "policy_state": "action_gated",
  "tags": ["facility-risk", "cyber", "cve", "fixture", "passive-enrichment-only"]
}
